"ID";"Name";"URL";"Description";"NC.1.0";"SA1";"SA2";"SA3";"SA4";"X.";"Notes";"X";"X.1";"Tipo";"V1";"V2";"V3";"NC_predicted"
1071743060;"Korean Journal of Medical Education for iPad";"https://itunes.apple.com/us/app/korean-journal-of-medical-education-for-ipad/id1071743060?mt=8";"The Korean Journal of Medical Education is the official publication of the Korean Society of Medical Education. It aims at development of the medical education by disseminating systematic and scientific research results on educational system, goals, methods, and evaluation in the field of medical health professions. The Korean Journal of Medical Education publishes high quality papers on themes related to health professional education including but not limited to Curriculum planning and development, Communication skills, Student selection, Teaching and learning method, Problem-based learning, Team-based learning, Professionalism, Educational policy, Leadership, Evaluation and assessment, Objective Structured Clinical Examination, Clinical Performance Examination, Evidence based medical education and Interprofessional medical education.";"1";"across specialties";"";"";NA;NA;"è sulla salute ma non so a che classe associarlo ";"";NA;"Test";"Across";NA;NA;1
1166859047;"Creative Christmas Hd Frames - Design scrapbook";"https://itunes.apple.com/us/app/creative-christmas-hd-frames-design-scrapbook/id1166859047?mt=8";"Would you like your pictures to be appearing in the beautiful frame? These fantasy frames are ideal for you to frame your memories and make them unforgettable. Using this app you can make photos more beautiful by decorating them with fantastic photo frames and effects.This app is the special Edition for this Year. Make your holidays as a great moment using this creative 500+ online frames.Features----------------------------------------------------------------- Select a photo from the gallery or take photos using camera.- Multiple stylish photo frames for your picture.- Apply effects to your picture.- Adjust position, size, angle of your photo by just finger gestures.- Save your image to Gallery.- Easy to use.- Share your creations via Facebook, Twitter, Flickr, email, and other social networks.";"0";"";"";"";NA;NA;"";"";NA;"Test";"Across";NA;NA;0
435214690;"EMT Tutor Lite - Scenarios";"https://itunes.apple.com/us/app/emt-tutor-lite-scenarios/id435214690?mt=8";"EMT Scenarios is now EMT tutor lite, with a practice quiz and flashcards. EMTutor presents over 50 scenarios written for the EMT based on real life situations. Also a practice test, and practice flashcards. Use the EMTutor Lite to see where you stand with recent updates with EMT Basic material. The scenarios are intended to be discussion generators for field instructors, teachers and mentors, or to aid the individual learning process. The discussions will expose gaps in the knowledge base and aid in the learning process. It is great for the seasoned EMT or those currently in class. Instructors can use these to take students through clinical practice or to aid in the development of EMT classes.There is also an app upgrade available to the full EMTutor which also includes over 900 multiple choice questions, and 900 flashcards, Skill Sheets, Differential Rule-outs, and Scene Checkoffs. Enjoy and stay safe out there!";"0";"";"";"";NA;NA;"non saprei, è sull'apprendimento, forse non è medica, anzi per me non è medica";"";NA;"Test";"Across";NA;NA;1
1150984188;"Mobaflex";"https://itunes.apple.com/us/app/mobaflex/id1150984188?mt=8";"Mobaflex is a Joint Monitoring System for Post-Operative Orthopedic PatientsOur wearable monitoring system comes in an all-inclusive kit which is leased to the patient for the 90 day at home recovery period for total knee arthroplasty. The comfortable Mobaflex band provides accurate range of motion monitoring to within a 5 degree accuracy, and submits data wirelessly to the Mobaflex app. The Mobaflex app is accessible by patients and providers, and allows for easy communication between patient and treatment team, accurate monitoring of progression, and convenient use from anywhere, at any time.";"1";"across specialties";"";"";NA;NA;"è un app ortopedica per monitoraggio post operatorio, ma ortopedia non c'è, come la segno? ###FRA### Io metterei solo across";"";NA;"Test";"Across";NA;NA;1
1152309322;"EVAC5";"https://itunes.apple.com/us/app/evac5/id1152309322?mt=8";"EVAC5 is an application available for use in emergencies. When the panic button is activated, EVAC5 uses your phone's GPS in order to determine your location. In the event that no GPS location is available, the application will plot your location via your network's cell phone towers.Your panic alert, location information and cell phone number are routed to the ER24 EMS contact centre. A contact centre co-ordinator will attempt to reach you telephonically, determine the nature of the emergency and send out the appropriate response unit.";"1";"emergency medicine";"";"";NA;NA;"situzioni di emergenza, vieni tracciato ####FRA### Ho tolto sensory systems perché secondo me emergency basta";"";NA;"Test";"Across";NA;NA;1
1332143119;"My Daily Weight";"https://itunes.apple.com/us/app/my-daily-weight/id1332143119?mt=8";"Control your daily weight and reach your goal!Track your progress and compare your progress with a pre-set goal.Visualize your weight and your goal through graphics.Do not lose your information. Data is stored in the cloud and can be accessed through other devices.";"0";"";"";"";NA;NA;"controllo del peso del peso, non ha scopi medici sembrerebbe ";"";NA;"Test";"Across";NA;NA;0
1101203009;"MED Q&A";"https://itunes.apple.com/us/app/med-q-a/id1101203009?mt=8";"Med Q&A is building an alternative to Health Insurance for people who cannot afford the real cost of Healthcare. At medqanda.com, we connect Survivors with all forms of Cancer with each other (as well as with HIV and many other medical and health conditions) and help them Video Conference with each other immediately. IT'S FREE!Med Q&A is composed of 11 major features: 1)Visualization, 2)  EMR Network, 3) 10-Minute Video Conference, 4) Community/Social Network, 5) Marketplace (services and medical devices), 6) Doctor Network, 7) Nurse/Caregiver Network, 8) Disability Employment HQ, 9) Tissue/Organ Donor Network, 10) Support Groups, 11) Video Conference Events and Webinars1) Visualization: Med Q&A Users receive a 3D-like Avatar, which lights up with different colors depending on the health condition they have, which they can control, which they can animate and select poses. Further, they can upload their favorite song & select a 3D background, etc. They can express themselves in a new, unique way.When the user designates his medical data as Anonymous and Public (as opposed to Anonymous and Private), he or she will be able to communicate with everyone else who has the same health condition he or she has, who is also ""Anonymous and Public."" Similarly, he or she will be able to receive communications from other people who have the same health condition.2) EMR Network: Med Q&A  provides this free-of-charge to individuals, health clinics and underfunded medical centers throughout the country. 3) 10-Minute Video Conference: Med Q&A helps Users (who, in general, do not have health insurance) speak with a doctor face-to-face. 4) Marketplace: Med Q&A healthcare-centric Marketplace focuses on healthcare equipment and medical devices. Each person's profile will already contain whether they are willing to a) donate or b) buy or c) sell or d) lend e) borrow and f) rent  prosthetics, wheelchairs, miscellaneous medical devices, services or tasks, etc.5) Doctor, Nurse/Caregiver and Healthcare Professional Networks: Med Q&A Users can easily make contact with a Healthcare professional. 6) Disability Employment HQ: Disabled persons can upload their resumes and enable potential employers to invite them to a video meeting.7) Tissue/Organ Donor Network: Repository for users who wish to donate tissue (i.e., plasma, platelets, hair, sperm, eggs, etc.) or are seeking tissue donors. 8) Support Groups (Video Conference): Med Q&A provides free (video conference) Support Groups for Survivors of almost every medical and health condition.9) Video Conference Events and Webinars: Med Q&A provides free Webinars for Survivors of almost every medical and health condition. Check our Event Schedule to participate in one right away!";"1";"across specialties";"";"";NA;NA;"è un sistema di sostituzione dell'assicurazione sanitaria, non so in che categoria metterla ";"";NA;"Test";"Oncology";"EmergencyMedicine";NA;1
1317929229;"Zen Leaf";"https://itunes.apple.com/us/app/zen-leaf/id1317929229?mt=8";"Zen Leaf is one of the nations premier cannabis dispensaries, where nature meets medicine. Zen Leaf proudly serves patients and customers in Maryland and Nevada, and is committed to providing a serene and comfortable environment for our patrons. Our team is extensively trained on our vast selection of cannabis products, and will work with you to tailor a custom regime specific to your individual needs. By building unique relationships with everyone who walks in our doors, Zen Leaf is dedicated to providing unmatched customer service with a customer-first approach.Zen Leaf stocks a wide array of products to match our customers varied tastes and preferences, and only offers for sale products which meet our high quality, potency, and safety standards.Use the Zen Leaf app to learn more about our dispensary, browse our current menu of products, review the latest deals and specials, learn how to legally purchase cannabis at one of our stores, and order products for pickup. Additionally, you may use the Zen Leaf app in select markets to order products for delivery right to your door!";"1";"across specialties";"";"";NA;NA;"fornisce medicinale a base di cannabis adeguandoli da persona a persona";"";NA;"Test";"SensorySystemsHealthcare";NA;NA;1
1183191489;"Workout Trainer-Personal Trainer App";"https://itunes.apple.com/us/app/workout-trainer-personal-trainer-app/id1183191489?mt=8";"Full Fitness Workouts  is comprehensive fitness experience is the portable personal trainer that completely guides your fitness lifestyle.  Full Fitness is for everyone, whether you are new to fitness or a seasoned veteran. Its also the definitive app for fitness professionals, coaches and physical therapists.FEATURES:  Two different 5 to 10 minute upper & lower body workouts Great for both men and women Video showing how to do each exercise  Developed by a certified personal trainer On-screen instructions and timer No gym or workout equipment required  Integrates with Health app Get Fitness Challange and become Fit in a days Great for both men and women Diet Plain for weightloss and healthy food is availible";"0";"";"";"";NA;NA;"app di fitness per l'allenamento, non medica";"";NA;"Test";"MentalHealth&Neurology";"Nutrition";NA;0
1352280983;"Timer for HIIT training";"https://itunes.apple.com/us/app/timer-for-hiit-training/id1352280983?mt=8";"Were proud to introduce this handy interval timer that helps you keep track of your work and rest periods during your HIIT interval training and workouts. This app is an awesome training timer, whether you're working on cycling, running, lifting weights, exercise, workout, stretching, boxing, MMA or HIIT, this interval timer will prove to be an invaluable asset for your HIIT interval training.This app can be used as HIIT timer, tabata timer, round timer, and anything else about interval training you want to track.Tabata timer is a full featured, easy to use Tabata timer Crossfit HIIT Interval training, kettle bells, running, cycling, or any interval fitness training.FEATURES:* 3 programmable timers * Customize all time settings* Customize number of series* Customize number of repetitions* easy to hear alerts* pause and resume session* restart session where you left off if interrupted* mute sound use in silent mode* screen changecolor for visual cue* Speaking coachIf you like this app please consider writing a positive review on the App Store, thank you.This will help us to add new features, fix any bugs, and improve implementation.";"0";"";"";"";NA;NA;"app di fitness per l'allenamento non medica";"";NA;"Test";"EmergencyMedicine";"SensorySystemsHealthcare";NA;0
890219494;"Partners In Elder Care";"https://itunes.apple.com/us/app/partners-in-elder-care/id890219494?mt=8";"We support caregivers. We Provide Senior Housing Transition Assistance, Medicaid Applications, VA Benefits Counseling, Companion Care, Home Safety Improvements, In-Home Care, Church Outings, Elder Law Assistance, Senior Real Estate assistance, Meals and Laundry.  Whatever the need, we'll find it for you.";"1";"across specialties";"";"";NA;NA;"non saprei, uno degli scopi è quello medico ma non si capisce il vero scopo ####FRA### si sembra più relativa all'assistenza sociale, ho messo non medica.";"";NA;"Test";"Across";NA;NA;0
879653371;"Medrills Military Modules";"https://itunes.apple.com/us/app/medrills-military-modules/id879653371?mt=8";"Medrills Military: Group or Single User Subscriptions allows access to download all Medrills Military training modules (Medrills Apps purchased seperately cannot be accessed through this app). Group Administrators can purchase licenses for multiple users as well as monitor progress and access to content.For a demo, see: http://youtu.be/vL9u_WvR8vw Yearly Subscription prices:1 User Subscription $23.991 User Subscription w/CEH Credits $27.995 User Subscription $109.995 User Subscription w/CEH Credits $129.9910 User Subscription $209.9910 User Subscription w/CEH Credits $249.9925 User Subscription $499.9925 User Subscription w/CEH Credits $599.99The Medrills subscription can be purchased for 1 year time period. This will entitle users to all Medrills Military Applications currently available as well as group managment tools for administrators.  Currently available applications:Administer Morphine, Cardiac Arrest Aed, Control Bleeding, Cricothyroidotomy, Hemostatic Dressing, Initiate Iv, Insert Combitube, Manage Iv, Needle Chest Decompression, Pressure Dressing, Saline Lock, Tourniquetsubscription terms: http://www.medrills.net/subscription/terms.html privacy policy: http://www.medrills.net/subscription/privacy.htm";"0";"";"";"";NA;NA;"applicazioni per militare ";"";NA;"Test";"GinecologyAndObstetrics";NA;NA;0
1256421882;"Musanda Program";"https://itunes.apple.com/us/app/musanda-program/id1256421882?mt=8";"Application for physicians to refer patients to the Musanda program and to track their progress";"0";"";"";"";NA;NA;"indirizzare i pazienti al programma Musanda non si capisce che programma sia###FRA### Basandosi solo sulla descrizione, io metterei non medica per il semplice fatto che la descrizione è insufficiente per far capire di cosa tratta";"";NA;"Test";"Across";NA;NA;0
930933802;"CHFT - The Three Rs";"https://itunes.apple.com/us/app/chft-the-three-rs/id930933802?mt=8";"One of the most powerful things anyone can do as a leader is to create a clear and compelling narrative for change that gives people a sense of direction and purpose. The three Rs are three conversations that can help you whenever you need to find a way forward.  When we get stuck or arent clear what to do it is often because one of these conversations is missing or incomplete.  By using the questions in this app you can organise your thinking and create a balanced strategic narrative for what you are trying to achieve.Use the three Rs if you:- Want to make a breakthrough- Have a problem that you arent clear how to tackle- Need to organise your thoughts about an important challenge or goal- Want to get your message clear about a change that you will be making";"0";"";"";"";NA;NA;"organizzare i pensieri";"";NA;"Test";NA;NA;NA;0
1199370220;"Leaving Cert Biology Q&A 2017";"https://itunes.apple.com/us/app/leaving-cert-biology-q-a-2017/id1199370220?mt=8";"Leaving Cert Biology Questions and Answers Higher Level Flash card Notes. 10 years of past paper facts in your pocket. This app is based on  what you need to know for the leaving cert biology higher level. Containing 825+ Questions that you should know for the Leaving Cert Biology exam.Flash card design to help you test yourself on the go anytime, anywhere.In this app the answers contain the key words and sentences that you need to know in order to get a good mark on your leaving cert.Everything you need to know to achieve your best in Leaving cert  Biology higher level The App is divided up into its various sections that you study in the Leaving Cert Biology.";"0";"";"";"";NA;NA;"preparare l'esame di biologia ";"";NA;"Test";NA;NA;NA;1
655242441;"OnScreen Retrovirus";"https://itunes.apple.com/us/app/onscreen-retrovirus/id655242441?mt=8";"Updated for the future: 64-bit native code. ""A Best Science App (highest rating: Excellent)--Great interface, easy navigation"" Genetic Engineering & Biotechnology News Dec 2013** NO ADS **Do you (or your students, if you're a teacher) know why the AiDS-causing virus, HIV, is called a retrovirus and how it actually uses the material and machinery of the ""host"" cell it has invaded to reproduce itself? Do you (or they) have a firm idea what the terms ""minus strand, PBS, PPT, and LTR"" mean? What does tRNA have to do with retroviruses, anyway? The simulations of OnScreen Retrovirus use the 3D nucleic acid models of our highly regarded DNA apps to make memorable the crucial steps by which the reverse transcriptase enzyme complex of a retrovirus uses nucleotide building blocks of the host cell to copy the viral genome, initially on a single strand of RNA, to a newly constructed double-stranded DNA molecule, ready to be inserted into the host's DNA as a source of new copies of the virus.The goal of this app is to convey the conceptual details of the viral genome transfer from RNA to DNA without requiring of the user a deep prior knowledge of molecular biology. Since a ball-and-stick model of nucleic acids is used for the simulations, this is not done at the level of atomic detail, but the simulations are never in conflict with the biochemistry.Unlike other simulations you might see on the internet, this app shows how the DNA synthesis is at every stage a three-dimensional double-helix-forming process and that it involves several steps, which include the separation of strands and the relative movement of the strands to allow annealing to each other at complementary sections, the steps being dependent on three separate activities of the reverse transcriptase complex: RNA-dependent DNA synthesis, RNA degradation, and DNA-dependent DNA synthesis. The role of the virus's nucleocapsid protein as enhancer of the annealing of strands is also indicated.Since retrotransposons--which we all have in our DNA!--make use the very same steps to make new copies of their DNA through an intermediate RNA strand before inserting it at another spot in the cell's DNA, the app serves as a simulation of how they work as well. Background material on viruses, nucleic acids, and enzymes, as well as commentary on each new step in the process of copying the single strand of RNA into a double-stranded DNA molecule are at your fingertips in the app. You can run the simulations with automatic pauses at key steps for convenience in reading of the commentary for the steps or straight through, pausing only when desired.Whether for first-time learning, clarification of ideas previously encountered, or review, OnScreen Retrovirus is now at your service.";"1";"across specialties";"";"";NA;NA;"L'obiettivo di questa app è quello di trasmettere i dettagli concettuali del trasferimento del genoma virale da RNA a DNA senza richiedere all'utente una profonda conoscenza preliminare della biologia molecolare.";"";NA;"Test";"GinecologyAndObstetrics";NA;NA;1
509838037;"ATI TEAS Pocket Prep";"https://itunes.apple.com/us/app/ati-teas-pocket-prep/id509838037?mt=8";"Pocket Prep is your award-winning tool for mobile learning and exam preparation. Pocket Prep allows you to study anywhere, anytime, right from your mobile device. We strive to make studying more efficient by redefining how you prepare for the Test of Essential Academic Skills (formerly called the TEAS V).* Academics Choice Smart Media award winner* EdTech Digest Cool Tool award winnerThe Science Behind Mobile Learning:Overloading your brain with too much information at once is a common study mistake. Research has shown that smaller, more frequent study sessions are the key to knowledge retention. In other words, taking short quizzes on the go is becoming a much more effective means of exam preparation than reading page after page in a textbook. Apps offer the benefit of interaction, which means youre far more likely to remember a concept you engage with rather than one youve only read about.Take your ATI TEAS studies with you, no matter where life takes you.ATI TEAS Content Areas:- English and Language Usage- Mathematics- Science- ReadingGet Started for Free:We provide a limited free version so you can get a feel for the app before deciding to upgrade. The free version offers over 120 questions with detailed answer explanations.- 80 free questions available with download- 30 free bonus questions available through social media- 14-day access to the Question of the Day (QOTD)- Comprehensive test-taking strategy guideUnlock the Ultimate Mobile Learning Experience:A one-time in-app purchase grants full lifetime access to our ATI TEAS app.- 1,375 total practice questions and detailed rationales- Lifetime access to Question of the Day (QOTD)- Unlock all social media bonus questions- Unlock Exam Builder to create customized exams- Priority in-app supportPocket Prep Features:- No internet required- Study Modes: See answers as you go or at the end- Retake past exams with a single tap- Study reminders and QOTD notifications- Automatic test saving and retrieval- Detailed history and results reporting- Exam day countdown- Multi-device readyOur team of writers and editors are industry leaders who have meticulously crafted practice questions and detailed answer explanations with you in mind. Since 2011, Pocket Prep has been the leader in mobile learning and has helped over five million students and professionals achieve more.Need help? Contact us through the apps support section at any time for a response within a few hours.";"0";"";"";"";NA;NA;"app per studiare ovunque ";"";NA;"Test";"MentalHealth&Neurology";"Surgery";"Cardiology";1
505057039;"Pictures with Words free";"https://itunes.apple.com/us/app/pictures-with-words-free/id505057039?mt=8";"2 million users love Pictures with Words! It's a free, fun, and simple way to make and share gorgeous Pictures with Words, Emoticons and Photos on your iPhone or iPad. Features:<U+2714> Pick from several gorgeous fonts and colors.<U+2714> Pick from the amazing selection of emoticons and emoji. <U+2714> Add even picture-in-pictures.<U+2714> Use the Pinch gesture to Zoom and Rotate<U+2714> Create photo collage and mix multiple photos together. <U+2714> Add captions and emoticons directly while taking photos<U+2714> Load from your camera roll<U+2714> Download beautiful images from the web. <U+2714> Download every minute a new trending image from the web<U+2714> Save or Share your photos via SMS, EMAIL, FACEBOOK, TWITTER, PINTEREST, INSTAGRAM, etc. Transform everyday moments into works of art you'll want to share with friends and family. -------------------------------------------------- Pictures with Words app takes picture taking and picture editing to the next level by allowing creative people enhance their original photos or images downloaded from the web. A picture enhanced with Pictures with Words app is a very different experience that million of users are discovering globally by playing with the app themselves. Most recipients of Pictures with Words enjoy the element of surprise the app brings compared to traditional picture sharing apps. A dedicated message in the picture caption, a cute emoticon or another picture embedded in the original snapshot are all greatly appreciated by the receivers because they make them feel the message was prepared just for them. ""Pictures with Words"" app makes it easy to place, size, and color text and emoticons. The picture creator can choose from hundreds of fonts and colors. Having composed the perfect text, users can save their new photo in the iPhone / iPad Photo Album, or share it from within the app via SMS, EMAIL, FACEBOOK, TWITTER, PINTEREST, INSTAGRAM, etc.Dont save or share standard photos anymore. A picture is worth a thousand words, but add a few captions and annotations and it is much more. -------------------------------------------------->>>>>>>>>>>>>>>>FAQs<<<<<<<<<<<<<<<<<<<<< How to rotate the text: -Just pinch the text with 2 fingers and rotate the fingers How to zoom the text: -Just pinch the text with 2 fingers and move them apart";"0";"";"";"";NA;NA;"app per le foto ";"";NA;"Test";"Across";NA;NA;0
896649230;"Crescent Medical Center";"https://itunes.apple.com/us/app/crescent-medical-center/id896649230?mt=8";"Crescent Medical Center Lancaster is an 84 bed acute care general hospital in Lancaster, Texas. This app includes many of the hospitals social media sites such as Facebook allowing the community to stay up to date on current health issues. Also included are a pair of forms which allow you to quickly make an appointment for either the ER or a regular checkup. There is even a click to call button which connects to the ER, for ease of access and speed during those emergency situations.";"1";"emergency medicine";"across specialties";"";NA;NA;"rimanere aggiornata sui problemi di salute attuali.oltre a monitorare le emergenze";"";NA;"Test";"Across";NA;NA;1
