ID	Name	URL	Category	Description	NC 1/0				Notes	
1206342925	OneGalaxy Ieris	https://itunes.apple.com/us/app/onegalaxy-ieris/id1206342925?mt=8	Medical	This tool is a service for pharmaceutical companies wishing to monitor their field force or medical representatives visits and transactions to their HCPs. MedReps input their activities in an online manner or offline manner: customised iOS app with their credentials.	0	ACROSS	SENSORY SYSTEM		Strumento per aziende farmaceutiche che desiderano monitorare le visite	
1121366132	MedUltra	https://itunes.apple.com/us/app/medultra/id1121366132?mt=8	Medical	Question: As an ultrasound practitioner, how many measurements do you have to process on a daily basis, and how many ultrasound reports do you need to create? How many tables from books and scientific articles do you need to endure?Enough questions. Medultra IS the answer!Medultra is the brainchild of a passionate Brazilian Radiologist. This groundbreaking app has been designed exclusively for radiologists, radiology trainees, sonologists, sonographers, and any other health professional dealing with ultrasound. Now, you can streamline the traditionally cumbersome approach, INSTANTLY accessing mountains of measurements in just TWO clicks  NOT hundreds of pages!Medultra is the result of MONTHS of hard-work and research. We studied 80+ scientific articles and 70+ measurements, so you dont have to. All of these are now available in ONE intuitive app with about 117 illustrative pictures among ultrasound images, vectorial and explanatory drawings!Havent heard of anything like Medultra before? Thats because its the first of its kind enjoying growing popularity in Brazil as one of the TOP medical apps!Simplify and streamline your daily tasks by purchasing Medultra today.	0	SENSORY SYSTEM			App per riadologia	
1292271145	Natl Transgender Health Summit	https://itunes.apple.com/us/app/natl-transgender-health-summit/id1292271145?mt=8	Medical	**FOR ATTENDEES ONLY**The Natl Transgender Health Summit mobile application allows you to view the schedule, presentations, posters, exhibitors, and speaker details from the conference. Users can take notes adjacent available presentation slides and draw directly on slides inside the app. Additionally, users can share information with attendees and colleagues with in-app messaging, tweeting, and emailing.	1				Per me non è medica parla di presentazioni e conferenze	sono d'accordo 
925477898	AFIB Checkup	https://itunes.apple.com/us/app/afib-checkup/id925477898?mt=8	Medical	Afib Checkup, an efficient point of care app for Atrial Fibrillation, allows medical professionals to quickly and accurately assess stroke risk, bleed risk, anticoagulant therapy, comorbidities and enhance the overall patient experience. This free app for iPad is intended for medical professionals includes access to:- Stroke and Bleed Risk Assessment - CHADs-VASc and HAS-BLED calculations are built in allowing for an efficient assessment of a patients risk.- Evaluate Therapy - Visually compare anticoagulants through a table or graph format to determine lowest combined stroke and bleed risk.- Patient History - Track previous risk assessments, add patient notes and email to another medical provider.- Patient Engagement - Discussion view provides a visual format to enhance patient dialogue and education on atrial fibrillation and available therapy options.  Patient discussion views can be emailed directly to patients or printed for quality measure attainment.- Health Data Security - Pin code access, unique patient identifiers and secure servers are in place to provide data security.Contact us at any time for your organization to gain access to:- EMR Integration - Notes and patient data are automatically saved to your EMR increasing efficiency and communication and preventing duplication.- Customized Care Pathways and Clinical Protocols - Customize the app for your health system or practice through the addition of care pathways and clinical protocols. -  Treatment Guidelines - Automatically updating treatment guidelines ensure you are always up to date on the latest recommended guidelines.This product isn't intended to diagnose or recommend treatment for any disease.	0	CARDIOLOGY			App per terapia coagulante con aggiunta di EMR per quello ho messo anche sensory	
1209610909	FitGrid Pro	https://itunes.apple.com/us/app/fitgrid-pro/id1209610909?mt=8	Health&Fitness	FitGrid Pro helps studios and instructors boost their client retention rate.  It gives instructors tools to organize schedules, follow up with class attendees, view client data, take notes, and review different types of analytics.  As instructor retention rates increase, so do that of the studios that employ them.	1					
396110426	Rohit Krishna	https://itunes.apple.com/us/app/rohit-krishna/id396110426?mt=8	Medical	Rohit Krishna  Doctor App:  Build your personalized physician iPhone App.Doctor App Improves:  Marketing & Branding, Patient Education/Communication and Practice EfficiencyTell Your Patients in Your Office or on Your Marketing Commercials: Download Me/Us on iTunesHow cool is that?  We make it happen!  Contact us:  company@cloudninedevelopment.comWe Build Doctor App or Your Practice App in DaysCloud Nine Development, LLCSmartphones and Web ApplicationsShould I have an App?Are Apps the next Web?  Undoubtedly the answer is Yes. You could and should be the first in your specialty in your area to have an App for your patients and referring physicians.Your Doctor App could be your personalized iPhone application that could be downloaded by your patients from iTunes.com for Free.  They will be able to find you on the iTunes App store by the name you choose (e.g. your name or practice name).  Doctor App has various features from office hours, GPS enabled directions to office locations, contact information to patient education material.  Doctor App could inform your patients about current events and services offered at your practice.  Patients could contact your office for medical records, medication refills, or ask a technician a question right from your application on their phone.  Patients or your referring physicians could request an appointment with you right from the phone through the Doctor App.  By uploading relevant patient education material, a specialist could have their referring doctors use your application for patient education material and then refer patients to you. Here are some of the reasons why a Doctor App would be beneficial compared to a website:User Interface customized to mobile phones and superior to web layout.Ability of user/patients/public to have improved, increased access to their physicians.Increased ability of the physician to reach out to their patients using a current news type function that will update each users application in real time.Potential to reduce costs and save time.  Users can contact/make requests of clinic/hospital staff without a phone call or in person contact.Easy accessibility to physicians offices through GPS enabled map functions on the smartphoneAbility of users to be able to have immediate access to a phone directory and synced callingPatients do not need to remember doctors or nurses names to navigate web and websitePersonalized patient education material that can we emailed or hosted on the application, with similarly personalized patient education videos. The videos can be present on the app and referring physicians can have the patient look at it before they come to see the specialist.We believe Doctor App has the potential to improve practice marketing and branding, patient education and communication, and personal and practice efficiency. Cloud Nine Development, LLC (www.cloudninedevelopment.com) is a company managed by physicians and they have developed the Doctor App.  Our first product is the Eye Handbook (www.eyehandbook.com), an iPhone application available on Apples iTunes store (www.iTunes.com).  For further information or to give your thoughts about Doctor App please feel free to contact us at company@cloudninedevelopment.com or visit the companys website at www.cloudninedevelopment.com (Fax: 1-888-602-5946).	0	ACROSS			Metto across ma potrebbe essere anche sensory	si forse avrei messo sensory, ma non saprei dire quale delle due è più importante
