"URL";"Name";"ID";"Category";"Description";"Keywords";"Version";"Age.Rating";"Language.s.";"Developer.ID";"Developer.Name";"Developer.URL";"Price";"Currency";"Size";"Last.Update.Date";"Release.Date";"Average.user.rating";"Number.of.user.ratings";"X..of.user.ratings.with.5.stars";"X..of.user.ratings.with.4.stars";"X..of.user.ratings.with.3.stars";"X..of.user.ratings.with.2.stars";"X..of.user.ratings.with.1.star";"Date"
"https://itunes.apple.com/us/app/lab-alpha-medical-converter/id1271467781?mt=8";"Lab Alpha: Medical Converter";1271467781;"Medical";"Easily & quickly convert US (United States) units to SI (International System of Units), or vice versa, wherever you are with full offline functionality. Create custom conversion calculators or use one of 300+ pre-loaded into the app.LAB ALPHA - HIGHLIGHTS Offline functionality Accurate conversions between US and SI medical units Over 300 preset conversion calculators Create your own custom converters Easily search through & find recently used calculators Create a list of favouritesQUICK CONVERSIONSWhen reading scientific journals, many scientists struggle to convert between imperial American units and International System of Units. With so many values, converting them mentally can be a challenge. With Lab Alpha, you can quickly convert any medical unit using your smartphone, so you can get back to reading.OVER 300 CONVERSION CALCULATORSWeve loaded the app up with over 300 ready-to-go medical unit converters. Quickly search through all the calculators to find the one you need, or create custom converters and save them to use whenever you need. Lab alpha is the simplest and most accurate way to convert the units of most common laboratory tests and drugs. Easily read any PubMed indexed journal such as NEJM, JAMA, The Lancet, Science, Nature and many more, no matter where in the world you are. FOR THE MOST ACCURATE MEDICAL UNIT CONVERSIONS  DOWNLOAD LAB ALPHA TODAY! For educational purposes only. Please read the disclaimer before use.";"Lab Alpha: Medical Converter, Medicon Apps, Medical, Education, ios apps, app, appstore, app store, iphone, ipad, ipod touch, itouch, itunes";"1.1";17;"English";307829597;"Medicon Apps";"https://itunes.apple.com/us/developer/medicon-apps/id307829597?mt=8";2,99;"$";17,9;"2017-08-24";"2017-08-16";NA;NA;NA;NA;NA;NA;NA;"2018-10-26"
"https://itunes.apple.com/us/app/kidearsmd/id1093365479?mt=8";"KidEarsMD";1093365479;"Medical";"Assisting pediatricians, neonatal care units, and parents by providing direct access to pediatric specialists for the evaluation and treatment of newborn ear deformities.Through our proprietary mobile application, clinicians and parents have a fast, easy, accurate assessment of a newborns ear shape. Should treatment be recommended, we coordinate immediate care by a local specialist in our preferred provider network.Compassionate, immediate, specialized care for newborn ear deformities.";"KidEarsMD, KidKutsMD Consultants, LLC, Medical, ios apps, app, appstore, app store, iphone, ipad, ipod touch, itouch, itunes";"1.0.4";4;"English";918905299;"KidKutsMD Consultants, LLC";"https://itunes.apple.com/us/developer/kidkutsmd-consultants-llc/id918905299?mt=8";0;NA;34,1;"2017-08-30";"2016-05-02";NA;NA;NA;NA;NA;NA;NA;"2018-10-26"
"https://itunes.apple.com/us/app/amta-exam-prep/id1040585600?mt=8";"AMTA Exam Prep";1040585600;"Medical";"The official American Massage Therapy Associations study app will help you prepare for the MBLEx like never before. Study anywhere, anytime with over 600 challenging practice questions and full answer rationales.Key App Features:- Two practice modes: simulation and study- Content updates pushed automatically- Automatic test saving and retrieval- Detailed history and results reporting- Question of the Day notifications- Exam day countdown- Intuitive navigation- Study reminders";"AMTA Exam Prep, Pocket Prep, Inc., Medical, Education, ios apps, app, appstore, app store, iphone, ipad, ipod touch, itouch, itunes";"6.5.6";12;"English";478383132;"Pocket Prep, Inc.";"https://itunes.apple.com/us/developer/pocket-prep-inc/id478383132?mt=8";0;NA;72,5;"2018-09-15";"2015-10-06";4,8;2400;87;0;2;11;0;"2018-10-25"
"https://itunes.apple.com/us/app/valley-center-smiles-dentistry/id1244776152?mt=8";"Valley Center Smiles Dentistry";1244776152;"Medical";"We are Valley Center Smiles a Dental Office located in Valley Center California owned and operated by Dr. Greg Carlson since 2011. Our Mobile App was designed to help us connect with you our client. In our app you can Book An Appointment, fill out our New Patient Form, Learn About Dental Hygiene, Earn Rewards for Regular Visits and more. Say yes to our Push Notifications for helpful reminders and updates.At Valley Center Smiles we offer the following services: Porcelain Fixed Bridges, Cosmetic Dentistry, Porcelain Crowns, Dental X-Rays, Composite Fillings, Dental Implants, Porcelain, Veneers, Porcelain Inlays and Onlays, Tooth Whitening, Dentures & Partial Dentures, Root, Canal Therapy, Prevention, Professional Dental, Cleanings, Dental Exams, Extractions, Wisdom Teeth.";"Valley Center Smiles Dentistry, Applified Marketing Group, LLC, Medical, ios apps, app, appstore, app store, iphone, ipad, ipod touch, itouch, itunes";"1.2";4;"English, Arabic, Azerbaijani, Catalan, Czech, Danish, Dutch, Finnish, French, German, Greek, Hebrew, Hungarian, Indonesian, Italian, Japanese, Korean, Norwegian Bokmål, Norwegian Nynorsk, Polish, Portuguese, Romanian, Russian, Simplified Chinese, Slovak, Spanish, Swedish, Traditional Chinese, Turkish, Ukrainian, Vietnamese";1154795843;"Applified Marketing Group, LLC";"https://itunes.apple.com/us/developer/applified-marketing-group-llc/id1154795843?mt=8";0;NA;47,7;"2018-03-16";"2017-06-05";NA;NA;NA;NA;NA;NA;NA;"2018-10-25"
"https://itunes.apple.com/us/app/own-your-awesome-inspiration/id1369221062?mt=8";"Own Your Awesome - Inspiration";1369221062;"Health&Fitness";"Daily inspiration to get you out of your head and into the now, where you remember how awesome you are, and all that IS possible. Hundreds of powerful thoughts and affirmations to lift you up, to ground you down and to keep you connected to your truest self. Open the APP anytime you are feeling stressed, overwhelmed, stuck, or wanting a boost of joy and inspiration.  Pull a card at random or swipe through the cards to find the perfect one for you at that moment.  You can also create a daily alert at the time of your choice to receive your daily dose of inspiration.Easily share the inspiration via text, email, Facebook, Pinterest, and Instagram.Heal your past. Create your future. Live your now.  Who you are is perfect. Who you are is necessary.  Accept yourself fully. Love yourself fully. Own who you are fully. Own Your Awesome!";"Own Your Awesome - Inspiration, Tricia Huffman, Lifestyle, Health & Fitness, ios apps, app, appstore, app store, iphone, ipad, ipod touch, itouch, itunes";NA;9;"English";1369221061;"Tricia Huffman";"https://itunes.apple.com/us/developer/tricia-huffman/id1369221061?mt=8";3,99;"$";55,2;NA;NA;5;17;100;0;0;0;0;"2018-10-25"
"https://itunes.apple.com/us/app/vision-simulator-vr/id1087300110?mt=8";"Vision Simulator VR";1087300110;"Health&Fitness";"Let your customers experience their lenses before they buy them, right in the store.Using customers actual prescription, the Hoya Vision Simulator allows you to provide a highlyaccurate, 3D representation of the optical effects of various lens designs and treatments.The Hoya Vision Simulator closes the gap between virtual reality and individual reality, giving yourcustomers the opportunity to choose the options that work best for them.The simulation include:- Lens Simulation (PAL, INDOOR)- enRoute- Outdoor Simulation (Tint, Polarised & Photochromic)- Coating Simulation- Quick Comparison";"Vision Simulator VR, Hoya Vision Care Europe, Health & Fitness, Lifestyle, ios apps, app, appstore, app store, iphone, ipad, ipod touch, itouch, itunes";"2.0";4;"English";492618708;"Hoya Holdings NV";"https://itunes.apple.com/us/developer/hoya-vision-care-europe/id492618708?mt=8";0;NA;2050;"2018-04-29";"2016-03-21";NA;NA;NA;NA;NA;NA;NA;"2018-10-25"
"https://itunes.apple.com/us/app/keiser-m-series-instructor/id1262638882?mt=8";"Keiser M Series Instructor";1262638882;"Health&Fitness";"The Keiser M Series Instructor app is a simple tool for monitoring class members in real time using Keiser M Series Intelligent equipment.  The app will find all nearby equipment and display live data in a simple scrolling view with options for sorting.  App does not require any additional hardware or systems.For more information about this app or other Keiser products, please visit our website at https://www.keiser.com.";"Keiser M Series Instructor, Keiser Corp., Health & Fitness, ios apps, app, appstore, app store, iphone, ipad, ipod touch, itouch, itunes";"1.1.1";4;"English";1094598974;"Keiser Corp.";"https://itunes.apple.com/us/developer/keiser-corp/id1094598974?mt=8";0;NA;22,6;"2017-08-08";"2017-08-07";NA;NA;NA;NA;NA;NA;NA;"2018-10-25"
"https://itunes.apple.com/us/app/cbg-coronary-bifurcation-guide/id1355779103?mt=8";"CBG Coronary Bifurcation Guide";1355779103;"Medical";"CBG is an app about coronary bifurcation techniques. It includes the most used bifurcation coronary angioplasty routines. CBG presents every step of each procedure, and compares all the different techniques. It'll will guide you in an intuitive way, with text, image and audio support, to develop the process from beginning to end precisely, without missing any step.CBG contains an algorithm to help you take best decision, considering different variables: bifurcation anatomy, and the needed material. CBG introduces at the beginning of each technique, pros and cons of the method, making it easier to select the most appropriate procedure, based on your cath lab resources.WHAT'S NEW IN CBG.How to perform the 'Reverse guide' Technique.";"CBG Coronary Bifurcation Guide, Jaime Ernesto Angulo Ortiz, Medical, Utilities, ios apps, app, appstore, app store, iphone, ipad, ipod touch, itouch, itunes";"1.0.2";17;"English";1280086716;"Jaime Ernesto Angulo Ortiz";"https://itunes.apple.com/us/developer/jaime-ernesto-angulo-ortiz/id1280086716?mt=8";9,99;"$";95,3;NA;NA;NA;NA;NA;NA;NA;NA;NA;"2018-10-25"
"https://itunes.apple.com/us/app/life-index-and-chronological-age/id612415389?mt=8";"Life Index and chronological age";612415389;"Health&Fitness";"Life Index tell you your status of Physic , Emotion , Intellegence base on Chronological age(How many years , months and days you've lived ) . This application also can predict possibility of pregnancy for ladies . Of course it can tell your Chronological age and how many days you lived";"Life Index and chronological age, Xiaodong Zhu, Lifestyle, Health & Fitness, ios apps, app, appstore, app store, iphone, ipad, ipod touch, itouch, itunes";"V1.1";4;"English, Simplified Chinese";414505553;"Xiaodong Zhu";"https://itunes.apple.com/us/developer/xiaodong-zhu/id414505553?mt=8";1,99;"$";4,9;"2013-03-21";"2013-03-11";NA;NA;NA;NA;NA;NA;NA;"2018-10-26"
