"URL";"Name";"ID";"Category";"Description";"Keywords";"Version";"Age.Rating";"Language.s.";"Developer.ID";"Developer.Name";"Developer.URL";"Price";"Currency";"Size";"Last.Update.Date";"Release.Date";"Average.user.rating";"Number.of.user.ratings";"X..of.user.ratings.with.5.stars";"X..of.user.ratings.with.4.stars";"X..of.user.ratings.with.3.stars";"X..of.user.ratings.with.2.stars";"X..of.user.ratings.with.1.star";"Date"
"https://itunes.apple.com/us/app/clinicalkey/id1041998175?mt=8";"ClinicalKey";1041998175;"Medical";"ClinicalKey is a clinical search engine from Elsevier, a world-leading provider of scientific, technical and medical information products and services.  When every second counts, ClinicalKey knows what clinicians need: fast answers built on trusted evidence. ClinicalKey helps clinicians rapidly access evidence-based, peer reviewed information to improve speed to accurate diagnosis and treatment, with the goal of improving patient outcomes and lowering the high cost of care. Its features have been designed utilizing extensive research on the search behaviors and content preferences of doctors.ClinicalKey is clinicians single source for trusted content covering more than 30 medical and surgical specialties. Content is indexed daily and continues to grow as new resources are published, ensuring that every decision clinicians make is based on the most current evidence.  ClinicalKeys Smart Search technology understands specific questions and pulls the most clinically relevant results from more than 1,000 reference books, 600 journals, 2,900 drug monographs, 17,000+ videos and more.  Clinicians can always be sure they are applying the right evidence for each unique patient scenario.ClinicalKey App for iOS Features:Persistent loginIntuitive search with auto-suggestAbility to bookmark and save itemsAccess to full-text books, full-text journals, guidelines, multimedia and moreTo get started with ClinicalKey1.    Download the free ClinicalKey App2.   Sign in securely using your ClinicalKey or Institution account";"ClinicalKey, Elsevier Inc., Medical, ios apps, app, appstore, app store, iphone, ipad, ipod touch, itouch, itunes";"1.10.1";12;"English, French, German, Japanese, Portuguese, Simplified Chinese, Spanish, Traditional Chinese";367031326;"Elsevier Inc.";"https://itunes.apple.com/us/developer/elsevier-inc/id367031326?mt=8";0;NA;20,4;"2018-01-10";"2016-01-05";1,8;22;14;14;5;0;68;"2018-10-25"
"https://itunes.apple.com/us/app/clubsportive/id1033938693?mt=8";"Clubsportive";1033938693;"Health&Fitness";"Everyone is welcome to work on their own personal athletic and health goals, we are more than happy to help you achieve your own goals.Whether you are 16 or 85, big or small, large or thin, athletic or a beginneror whatever meets you description.We are here to help and motivate you while working on your health goals. Clubsportive believes in a positive and energetic vibe.PLEASE NOTE: YOU NEED A Clubsportive ACCOUNT TO ACCESS THIS APP. IF YOU'RE A MEMBER GET IT FOR FREE AT YOUR GYM!Begin your journey to a healthier lifestyle and let Clubsportive help you along the way. Introducing Clubsportive, most comprehensive fitness platform with:* Check class schedules and opening hours* Track your daily fitness activities* Track your weight and other body metrics* Over 2000+ exercises and activities* Clear 3D exercise demonstrations* Preset workouts and the option to create your own* Over 150 badges to earnSelect workouts online and synchronize them with your app to workout at home or in the gym while keeping track of your progress. From strength to weight lifting, this app acts as your own personal trainer guiding and giving you the motivation you need. Also check our website for many extra tools, such as your personal fitness profile, free nutrition plan, goal setting and much more!You can sync this app with Apple Health App. If you enable this connection, any workout in the Health app with automatically be added to your Activity Calendar.";"Clubsportive, Virtuagym.com, Health & Fitness, ios apps, app, appstore, app store, iphone, ipad, ipod touch, itouch, itunes";"4.5.10";12;"English, Dutch, French, German, Greek, Italian, Latvian, Lithuanian, Norwegian Bokmål, Polish, Portuguese, Russian, Spanish, Turkish";336331599;"DIGIFiT BV";"https://itunes.apple.com/us/developer/virtuagym-com/id336331599?mt=8";0;NA;81,9;"2018-07-25";"2015-11-24";NA;NA;NA;NA;NA;NA;NA;"2018-10-25"
"https://itunes.apple.com/us/app/breathe-11-11/id1222805188?mt=8";"Breathe 11:11";1222805188;"Health&Fitness";"Breathe 11:11 is a free app that reminds users to take a deep breath, make a heartfelt wish, and connect with others at 11:11 daily. Many people around the world already intuitively make a wish and have positive  even magical -- associations with 11:11. This app is intended to accelerate and amplify this phenomenon to catalyze more optimism, peace and synchronicity in the world today. It is a simple, yet profound, mini-meditation that has long-lasting and unexpected results. The app includes a custom sound that users can set to chime at 11:11 in any time zone, allowing them to breathe, wish and connect simultaneously with friends and family across the globe. It also allows users to set a personalized notification to remind them of whatever they want at 11:11; and a map to can see where around the world people have downloaded the app. Theres a brand new http://breathe1111.com/podcast/ featuring fascinating interviews with numerologists, psychologists, artists, physicists, mystics and everyday people who have incredible 11:11 stories to share. Finally, the app has a built-in voice recorder which allows users to record and upload their own 11:11 stories for us to use in this podcast.";"Breathe 11:11, Bodhisattva, LLC, Lifestyle, Health & Fitness, ios apps, app, appstore, app store, iphone, ipad, ipod touch, itouch, itunes";"1.2.1";4;"English";1222805187;"Bodhisattva, LLC";"https://itunes.apple.com/us/developer/bodhisattva-llc/id1222805187?mt=8";0;NA;25,4;"2017-10-19";"2017-09-27";5;8;100;0;0;0;0;"2018-10-25"
"https://itunes.apple.com/us/app/fitastic-record-exercise/id951343497?mt=8";"Fitastic - Record exercise";951343497;"Health&Fitness";"Fitastic is a fitness tracker to help you record your daily exercise and show you the statistical data. It has multiplex and selectable workout items to meet your personal fitness needs like plank/push-up/situp/dumbbell/yoga etc. Features:- Record your exercise by time/distance/frequency.- Customize the fitness project based on your request.- Shows the weekly stat data clearly.- Detailed statistical data of days/total/average .- Customize the fitness project's style and color.- Support export and share the daily exercise record details.";"Fitastic - Record exercise, Bang, Health & Fitness, Utilities, ios apps, app, appstore, app store, iphone, ipad, ipod touch, itouch, itunes";"1.1.3";4;"English";529028930;"bang chen";"https://itunes.apple.com/us/developer/bang/id529028930?mt=8";1,99;"$";6,3;"2018-10-01";"2014-12-30";NA;NA;NA;NA;NA;NA;NA;"2018-10-26"
"https://itunes.apple.com/us/app/central-hospital/id1222599577?mt=8";"Central Hospital";1222599577;"Medical";"This free app provides integrated functionality allowing rDVMs to quickly access location information, newsletters, and CE opportunities with Central Hospital For Veterinary Medicine.  If registered with Central for portal access, then the rDVM can view patient information and seamlessly refer cases to our specialty practice. Features include: Refer-A-Patient View details for prior referrals  Share referral information and specialty practice location with clients  View and register for CE opportunities  Read our latest newsletter and interesting articles  Other valuable features";"Central Hospital, JSI Group, LLC, Medical, Reference, ios apps, app, appstore, app store, iphone, ipad, ipod touch, itouch, itunes";"1.4.0";12;"English";1192371404;"JSI Group, LLC";"https://itunes.apple.com/us/developer/jsi-group-llc/id1192371404?mt=8";0;NA;32,1;NA;NA;NA;NA;NA;NA;NA;NA;NA;"2018-10-25"
"https://itunes.apple.com/us/app/pah-reference-guide/id1008810456?mt=8";"PAH Reference Guide";1008810456;"Medical";"Featuring medical content, PAH Reference Guide is a practical tool for US healthcare professionals and their staff. PAH Reference Guide mobile app delivers relevant and helpful information for the pathology, diagnosis, and treatment of Pulmonary Arterial Hypertension (PAH).";"PAH Reference Guide, Actelion Pharmaceuticals Ltd, Medical, Education, ios apps, app, appstore, app store, iphone, ipad, ipod touch, itouch, itunes";"1.0.8";12;"English";699531937;"Actelion Pharmaceuticals Ltd";"https://itunes.apple.com/us/developer/actelion-pharmaceuticals-ltd/id699531937?mt=8";0;NA;19,6;"2016-06-16";"2015-06-28";NA;NA;NA;NA;NA;NA;NA;"2018-10-26"
"https://itunes.apple.com/us/app/ecg-cases-for-cme-emt/id798663024?mt=8";"ECG - Cases for CME & EMT";798663024;"Medical";"Over ONE MILLION users are using ECG Cases to learn and sharpen electrocardiography knowledge and skills! They are medical students and teachers, primary healthcare providers, physicians, practitioners, and nurses. Join them today to get your ECG knowledge refresh.Medical App Editor's Review:Here is a beautiful app with rich collection of real 12-lead ECG cases you can use to develop your interpretation skills. Each case is identified with a brief description (e.g., ""Male 73 y/o, HR 158; Ectopic arrhythmia - atrial tachycardia with intraventricular aberrant conduction...""). Select a case and you can choose either Play mode, which shows you the ECG telemetry as you'd see it on a monitor in real time, with beeps for heartbeats, or Read mode, which gives you the printed ECG tracing to interpret. You can choose cases by category or search for them by name. You can also bookmark cases and return to them later.For students and practitioners who wish to strengthen their ECG-reading capabilities, this app would seem justified, because ECG Cases gives you an effective way to immerse yourself in a wide range of ECG patterns and interact with them as if these were your own patients.Customer Reviews:1. Excellent for review of multiple rhythms. You'll need to come with your basic understanding of EKG interpretation but the app is great for a challenge.2. Great variety of cases and interpretation help break down the rhythms. Perfect way for students to study3. It is a great learning tool. I use this app for school and it helps out a lot for understanding how to read them and what to look for.4. Excellent learning tool for newbies and as ongoing refresher for others. Great examples5. Very detailed app for learning ECGs, all my staff has this app for continued learning.6. As a medic student this app is amazing. It's helped me a lot more than I could have hoped for.7. I have been a paramedic for 15 yrs, I found this app to be an excellent tool for refreshing and expanding my knowledge8. Great app. Most of strips are above my skill level a a paramedic but still fun to play and learn. Very well rendered. Would be nice if there was a ""basic"" version of this for paramedics and nurses. Also a brief explanation of why a strip is interpreted the way it is would be helpful.""I'm reviewing the app with my father who happens to be a specialist in internal medicine, and we're astonished with this app capabilities in helping students like myself understand EKG waves. It's not easy but with the help of this app EKG makes more sense to me.""""This is a great App that exemplifies and provides easy training for medical professionals. It is a tool that anyone working in the medical industry should possess.""""Great app for keeping your skills sharp and seeing a wide variety of cases""*******************************For Volume Licensing & Cooperation, please contact: ecgcases@gmail.comECG provides: 1) 1000+ abnormal real world 12 lead ECG cases in raw data (In-App-Purchase needed for advanced ones)2) Each case has professional interpretation and measurement 3) They cover 100+ common ECG findings [Features] 1) Browse ECG cases by findings like ""Atrial Flutter"", ""Escape Rhythm"" and more 2) Search for whatever you want to learn, like ""Flat T wave"" 3) Dynamically play each case in monitoring mode (with beeping sound) 4) Display leads in 12 x 1, 6 x 2, 4 x 3 layout 5) Each case has 12 template views with P / QRS / T waves identified 6) Send cases to your friends, in PDF format ++++++++++++++++++++++++++++++++++++++++++ THE BEST 12-LEAD ECG CASE LIBRARY ON APP STORE ++++++++++++++++++++++++++++++++++++++++++ For students or interns, you can use the cases as learning resources. For teachers, you can use the cases as teaching resources.";"ECG - Cases for CME & EMT, WMS, Inc, Medical, Education, ios apps, app, appstore, app store, iphone, ipad, ipod touch, itouch, itunes";"4.7.1";12;"English, Chinese, Italian, Japanese, Simplified Chinese, Traditional Chinese";471623357;"WMS, Inc";"https://itunes.apple.com/us/developer/wms-inc/id471623357?mt=8";0;NA;135;"2018-06-15";"2015-02-03";4,6;335;77;1;5;14;4;"2018-10-25"
"https://itunes.apple.com/us/app/teas-mastery-test-version-6/id911128301?mt=8";"TEAS Mastery: Test Version 6";911128301;"Medical";"Ace your ATI* TEAS exam with this best selling app. Review 1,300+ practice questions, quizzes, and tests anytime, anywhereno internet connection required! With ATI TEAS (Test of Essential Academic Skills)  Mastery, you can study with practice questions at lunch, between classes or while waiting in line. This app uses proven test-taking and study strategies so that youll feel confident and ready to go when test time arrives.Begin your nursing school journey and download ATI TEAS Mastery!Our Full Version includes: 1,300+ ATI exam-like practice questions with explanations and images 40+ quiz questions organized by category 400+ vocab flashcards Proven test-taking and study strategies to raise your score Immediate feedback to track your overall progress In-depth statistics that display your strengths and weaknessesIf you are about to take the ATI TEAS Exam, you will love this app.Get access to all questions when you subscribe: TEAS Mastery - 1 Month: one auto-renewing payment of $9.99 each month TEAS Mastery - 3 Month: one auto-renewing payment of $23.99 every three months TEAS Mastery - 12 Months: one auto-renewing payment of $59.99 each yearTEAS Mastery offers three auto-renewing subscription options to help you pass your exam.-Payment will be charged to iTunes Account at confirmation of purchase-Subscription automatically renews unless auto-renew is turned off at least 24-hours before the end of the current period-Account will be charged for renewal within 24-hours prior to the end of the current period, and identify the cost of the renewal-Subscriptions may be managed by the user and auto-renewal may be turned off by going to the user's Account Settings after purchase-Any unused portion of a free trial period, if offered, will be forfeited when the user purchases a subscription to that publication, where applicableThese prices are for United States customers. Pricing in other countries may vary and actual charges may be converted to your local currency depending on the country of residence.We are nursing professionals, not a publishing company. We are here for you and love talking with students at each step of the journey to becoming a nurse. Please contact us if you have any questions, suggestions or comments about our pre-nursing school study guide: nursing@hltcorp.com or call 319-237-7162.*Higher Learning Technologies is an independent test preparation company and is not associated with Assessment Technologies Institute (ATI). All names and trademarks are the property of their respective owners.Privacy Policy - http://builtbyhlt.com/privacyTerms of Conditions - http://builtbyhlt.com/EULA";"TEAS Mastery: Test Version 6, Higher Learning Technologies, Medical, Education, ios apps, app, appstore, app store, iphone, ipad, ipod touch, itouch, itunes";"5.26.1";4;"English";571804544;"Higher Learning Technologies LLC";"https://itunes.apple.com/us/developer/higher-learning-technologies/id571804544?mt=8";0;NA;137;"2018-10-13";"2017-03-30";4,7;1600;82;1;4;11;2;"2018-10-24"
"https://itunes.apple.com/us/app/gtb-forearm-tests/id1226676495?mt=8";"Gtb Forearm Tests";1226676495;"Medical";"The GTB forearm tests application is an essential reference tool for measurements of forearm torque, grip- and lifting strength.It is intended for researchers and medical professionals, such as surgeons or therapists, who treat upper extremity disorders.The aim of this application is to facilitate and improve objective assessments of wrist- and upper extremity disorders.The GTB forearm tests application provides:+ information about measuring techniques including videos+ presentation of expected normal average values based on gender, age and height+ ability to store measurements from different patients or occasions+ automatic comparisons with reference values+ a switch for instant change between SI and US force units";"Gtb Forearm Tests, Moose Medical HB, Medical, ios apps, app, appstore, app store, iphone, ipad, ipod touch, itouch, itunes";NA;4;"English";1226676494;"Moose Medical HB";"https://itunes.apple.com/us/developer/moose-medical-hb/id1226676494?mt=8";0;NA;40,6;NA;NA;NA;NA;NA;NA;NA;NA;NA;"2018-10-26"
"https://itunes.apple.com/us/app/eugms/id1081035793?mt=8";"EuGMS";1081035793;"Medical";"The EUGMS App gives you access to the Scientific Program of the Congress,  list of Speaker, maps of the exhibition area, list of Sponsors, things to do in Lisbon, and many other information in real time during the Congress.";"EuGMS, StudioVisio, Utilities, Medical, ios apps, app, appstore, app store, iphone, ipad, ipod touch, itouch, itunes";"1.3";4;"English, Italian";997696687;"Studio Visio SRL";"https://itunes.apple.com/us/developer/studiovisio/id997696687?mt=8";0;NA;18,6;"2018-10-03";"2016-03-04";NA;NA;NA;NA;NA;NA;NA;"2018-10-26"
